{
  "$schema": "https://json-schema.org/draft/2020-12/schema",
  "$id": "https://raw.githubusercontent.com/ServiceToMankind/sakshi/main/schemas/case.schema.json",
  "title": "Sakshi Case Record",
  "description": "The single source of truth for a published case record. This is a civic-accountability record of a PUBLICLY REPORTED case, not a substitute for official crime statistics. Victim identity is NEVER ingested: by design there is no field capable of holding a victim/survivor name, age (beyond the boolean minor_involved), address, family, school, workplace, photo, contact, or any re-identifying detail. Dedup and matching are case-anchored (FIR/CNR/station/district/date/court), never on identity. additionalProperties:false at every object level makes forbidden fields impossible.",
  "type": "object",
  "additionalProperties": false,
  "required": [
    "id",
    "title",
    "state",
    "district",
    "category",
    "status",
    "minor_involved",
    "sources",
    "confidence",
    "first_published"
  ],
  "properties": {
    "id": {
      "type": "string",
      "description": "Deterministically assigned, never reused. SKS-{4-digit year}-{2-letter STATE code}-{6-digit zero-padded serial}.",
      "pattern": "^SKS-\\d{4}-[A-Z]{2}-\\d{6}$"
    },
    "cnr": {
      "type": "string",
      "description": "Court Case Number (CNR) from eCourts/NJDG when available. Used for exact-match dedup."
    },
    "fir_ref": {
      "type": "object",
      "description": "First Information Report reference. Used for case-anchored dedup, never for identity.",
      "additionalProperties": false,
      "properties": {
        "station": {
          "type": "string",
          "description": "Police station name."
        },
        "number": {
          "type": "string",
          "description": "FIR number as recorded (e.g. \"112/2026\")."
        }
      }
    },
    "state": {
      "type": "string",
      "description": "2-letter Indian state/UT code (e.g. TG, AP, MH, DL, KA, TN, UP, WB).",
      "pattern": "^[A-Z]{2}$"
    },
    "district": {
      "type": "string",
      "description": "District within the state."
    },
    "incident_reported_date": {
      "type": "string",
      "description": "Date the case was publicly reported/registered. Full ISO YYYY-MM-DD for non-minor cases; truncated to YYYY (year only) when minor_involved is true (POCSO s.23). The conditional below enforces the right granularity per case.",
      "pattern": "^\\d{4}(-\\d{2}(-\\d{2})?)?$"
    },
    "offence_sections": {
      "type": "array",
      "description": "Statutory sections cited, in CANONICAL form (e.g. \"BNS 64\", \"POCSO 6\", \"IPC 376\"). Normalised and de-duplicated deterministically by pipeline/offence_sections.py (§4b) so severity mapping and dedupe see clean input. Public charge codes only — never victim data.",
      "items": {
        "type": "string"
      }
    },
    "unparsed_sections": {
      "type": "array",
      "description": "Original offence-section tokens that carried NEITHER a known act NOR a section number (e.g. \"rape\", \"sexual_assault\") — real junk separated out of offence_sections by the §4b normaliser and surfaced here for review. Public charge-shaped text only, never victim data. Absent when there is nothing unparsed.",
      "items": {
        "type": "string"
      }
    },
    "category": {
      "type": "string",
      "description": "Sexual-offence category. This record tracks SEXUAL offences only; \"other\" means an OTHER SEXUAL offence (e.g. stalking, voyeurism, disrobing under BNS Chapter V) — never a non-sexual crime. Non-sexual cases are rejected at extraction (in_scope=false) and, as a second layer, quarantined at dedupe when offence_sections carry no qualifying BNS/POCSO/IPC sexual-offence section.",
      "enum": [
        "sexual_assault",
        "rape",
        "pocso",
        "acid_attack",
        "harassment",
        "other"
      ]
    },
    "minor_involved": {
      "type": "boolean",
      "description": "Whether a minor is involved. This is the ONLY age-related fact stored; no actual age is ever recorded (POCSO Act s.23)."
    },
    "status": {
      "type": "string",
      "description": "Current judicial status per public court records. Presumption of innocence applies; ACQUITTED and QUASHED are rendered with equal prominence.",
      "enum": [
        "FIR_FILED",
        "CHARGESHEETED",
        "UNDER_TRIAL",
        "CONVICTED",
        "ACQUITTED",
        "APPEAL_PENDING",
        "CLOSED",
        "QUASHED",
        "UNKNOWN"
      ]
    },
    "accused_count": {
      "type": ["integer", "null"],
      "minimum": 1,
      "description": "Number of accused stated in the public record (§6b) — a COUNT, never a name. Non-identifying, so it is kept even for a minor case and feeds the deterministic minor summary composer. Absent/null when not stated."
    },
    "repeat_offence": {
      "type": ["boolean", "null"],
      "description": "True if the accused is a repeat/habitual offender per the public record (or repeat-offender charge sections). Non-identifying. Absent/null when not stated."
    },
    "weapon_or_threat": {
      "type": ["boolean", "null"],
      "description": "True if a weapon or threat/coercion is stated in the public record. Describes the ACT, never the victim. Absent/null when not stated."
    },
    "institutional_actions": {
      "type": "array",
      "items": {
        "type": "string",
        "enum": ["arrest_made", "chargesheet_filed", "bail_granted", "bail_denied", "sit_formed", "suspension_ordered", "convicted", "acquitted", "appeal_filed"]
      },
      "description": "The institutional/legal response as a closed ENUM set (§6b) — the accountability facts, incapable of holding identifying prose. Feeds the deterministic minor summary composer. Absent/empty when none stated."
    },
    "sentence_years": {
      "type": ["integer", "null"],
      "minimum": 0,
      "description": "Custodial sentence length in years when a conviction states one — a NUMBER only. Non-identifying. Absent/null when not stated."
    },
    "status_history": {
      "type": "array",
      "description": "Chronological status changes. Each entry cites a source by integer index into sources[].",
      "items": {
        "type": "object",
        "additionalProperties": false,
        "required": ["status", "date", "source"],
        "properties": {
          "status": {
            "type": "string",
            "enum": [
              "FIR_FILED",
              "CHARGESHEETED",
              "UNDER_TRIAL",
              "CONVICTED",
              "ACQUITTED",
              "APPEAL_PENDING",
              "CLOSED",
              "QUASHED",
              "UNKNOWN"
            ]
          },
          "date": {
            "type": "string",
            "description": "Full ISO YYYY-MM-DD for non-minor cases; truncated to YYYY-MM when minor_involved is true (day precision is not stored for a minor). Enforced by the conditional below.",
            "pattern": "^\\d{4}-\\d{2}(-\\d{2})?$"
          },
          "source": {
            "type": "integer",
            "minimum": 0,
            "description": "Zero-based index into this record's sources[] array."
          }
        }
      }
    },
    "accused": {
      "type": "array",
      "description": "Accused persons. An accused is presumed innocent until proven guilty. Names are stored ONLY when present in an official court record.",
      "items": {
        "type": "object",
        "additionalProperties": false,
        "required": ["label", "name_public_court_record", "status"],
        "properties": {
          "label": {
            "type": "string",
            "description": "Stable neutral label (e.g. \"Accused #1\")."
          },
          "name_public_court_record": {
            "type": ["string", "null"],
            "description": "Accused name ONLY when it appears in an official court record (judgment/order/cause list). null for media-sourced cases; the UI then shows \"Withheld (media-sourced, not yet in court record)\"."
          },
          "status": {
            "type": "string",
            "enum": [
              "FIR_FILED",
              "CHARGESHEETED",
              "UNDER_TRIAL",
              "CONVICTED",
              "ACQUITTED",
              "APPEAL_PENDING",
              "CLOSED",
              "QUASHED",
              "UNKNOWN"
            ]
          }
        }
      }
    },
    "court": {
      "type": "object",
      "description": "Court handling the case.",
      "additionalProperties": false,
      "properties": {
        "name": {
          "type": "string",
          "description": "Court name (e.g. \"Special POCSO Court, Hyderabad\")."
        },
        "next_hearing": {
          "type": ["string", "null"],
          "format": "date",
          "description": "Next hearing date if scheduled, else null. ISO YYYY-MM-DD."
        }
      }
    },
    "days_since_reported": {
      "type": ["integer", "null"],
      "minimum": 0,
      "description": "Days elapsed since the case was first reported — NEUTRAL elapsed time, not verified pendency. A pending / 'days without justice' claim requires a re-checkable court anchor, so the pendency leaderboard and jurisdiction medians additionally filter on that (§ pendency honesty). MUST be null when minor_involved is true (a day-precise derivation is not stored for a minor)."
    },
    "title": {
      "type": "string",
      "maxLength": 90,
      "minLength": 1,
      "description": "Short plain-English factual title (<=90 chars), no sensationalism. Model-written for non-minor cases; for a minor case it is generated DETERMINISTICALLY by pipeline.sanitize from allowed non-identifying fields only (enforced by the conditional below)."
    },
    "summary": {
      "type": "string",
      "maxLength": 700,
      "description": "Plain-English neutral summary (up to 4 short sentences: what happened, where, and what the police and courts did — #267), no victim details. When minor_involved is true BOTH title and summary are generated DETERMINISTICALLY by pipeline.sanitize.project_minor_record from allowed fields only (enforced by the conditional below); the model-written narrative is never published for a minor case."
    },
    "sources": {
      "type": "array",
      "minItems": 1,
      "description": "Citable public sources. Nothing without a citable public source is published.",
      "items": {
        "type": "object",
        "additionalProperties": false,
        "required": ["url", "publisher", "retrieved"],
        "properties": {
          "url": {
            "type": "string",
            "format": "uri",
            "description": "Public URL of the source."
          },
          "publisher": {
            "type": "string",
            "description": "Publisher or court (e.g. \"eCourts\", \"The Hindu\")."
          },
          "source_type": {
            "type": "string",
            "description": "Provenance class, assigned deterministically from the source (§3 tiers: court=1, legal_press=2, news_article/press_release=3, live_blog=4). A record whose ONLY sources are live_blog is capped below the publish threshold and quarantined for human confirmation (a rolling live-updates page is not durable provenance for a permanent public claim).",
            "enum": ["court", "legal_press", "news_article", "live_blog", "press_release"]
          },
          "retrieved": {
            "type": "string",
            "format": "date",
            "description": "Date the source was retrieved. ISO YYYY-MM-DD.",
            "pattern": "^\\d{4}-\\d{2}-\\d{2}$"
          },
          "url_carries_identifying_slug": {
            "type": "boolean",
            "description": "True if this source URL's own slug states a detail this record withholds — a victim age, gender, accused–victim relationship, or institution (§5). Set deterministically by pipeline/citation_slug.py. The site never renders the raw URL as anchor text (domain only) and tucks a flagged source behind an expander; clean sources are shown first. Absent/false means the slug carries no such detail."
          },
          "archive_url": {
            "type": "string",
            "format": "uri",
            "description": "A pre-EXISTING Internet Archive (Wayback) snapshot of this source, for citation permanence when the original rolls off the feed. Looked up read-only via pipeline/archive.py (the availability API) — a capture is NEVER triggered. Set ONLY for sources that do NOT carry the §5 identifying-slug flag, so a permanent third-party copy of an identifying URL is never referenced. Additive field — additionalProperties:false is unchanged."
          }
        }
      }
    },
    "confidence": {
      "type": "number",
      "minimum": 0,
      "maximum": 1,
      "description": "Extraction confidence 0..1. Records below 0.8 are quarantined to data/_review/ and never auto-published."
    },
    "first_published": {
      "type": "string",
      "format": "date",
      "description": "Date this record first entered the public tree. Written ONCE, then immutable. ISO YYYY-MM-DD. (Replaces last_verified, which restamped daily and made the whole site appear to change every morning — §1.)",
      "pattern": "^\\d{4}-\\d{2}-\\d{2}$"
    },
    "last_status_change": {
      "type": "string",
      "format": "date",
      "description": "Date a MATERIAL field (status, court, offence_sections, accused, severity) last actually changed. ABSENT when no change has ever been observed. Bumps only on a real change — a new corroborating source alone is not a change. The 'date the pipeline last re-examined the case' (last_checked) is INTERNAL (data/_meta/), never here.",
      "pattern": "^\\d{4}-\\d{2}-\\d{2}$"
    },
    "verified": {
      "type": "boolean",
      "description": "True if the grounding verifier (guardrail L) confirmed every field against the source and re-checked scope. Absent/false means not verified (auto mode publishes only verified records)."
    },
    "verification_note": {
      "type": "string",
      "maxLength": 300,
      "description": "Short verifier note (corroboration found, or the reason it demoted/corrected). Contains NO victim details."
    },
    "corrected": {
      "type": "boolean",
      "description": "True if a reviewed human-authored correction (corrections/<id>.yml, applied by pipeline.corrections before sanitize) narrowed or fixed a field on this record. The site shows a 'Corrected' marker; the audit trail lives in the committed correction file. Additive field — additionalProperties:false and the forbidden-field list are unchanged."
    },
    "traced_to_court": {
      "type": "string",
      "format": "date",
      "pattern": "^\\d{4}-\\d{2}-\\d{2}$",
      "description": "The date a media-only (tier ≥ 2) record first gained a COURT source — an unregistered/untracked case entering the visible judicial record, the project's highest-value event (§3). Set once by the sharder when a court source appears; the site shows 'Traced to a court record on <date>'. Additive field — additionalProperties:false and the forbidden-field list are unchanged."
    },
    "incident_date_provenance": {
      "type": "string",
      "enum": ["source_url", "wayback", "first_published"],
      "description": "Present ONLY when incident_reported_date's MONTH was recovered deterministically (pipeline.date_recovery, issue #124) for a record that would otherwise be year-only. Names the evidence that supplied the month — a date in a source URL path, the Wayback first-seen snapshot, or first_published — each accepted only when its YEAR matches the incident year (a month is never invented). Absent for a genuinely month/day-precise date. Non-identifying provenance flag — additionalProperties:false and the forbidden-field list are unchanged."
    }
  },
  "allOf": [
    {
      "description": "Phase 0 / POCSO s.23: a minor case is stored at the reduced granularity produced by pipeline.sanitize.project_minor_record. This is the SECOND independent layer (the first is the sanitizer) — a non-projected minor record fails validation and never ships. All referenced properties already exist above, so additionalProperties:false is unaffected.",
      "if": {
        "required": ["minor_involved"],
        "properties": { "minor_involved": { "const": true } }
      },
      "then": {
        "not": { "required": ["accused"] },
        "properties": {
          "incident_reported_date": { "pattern": "^\\d{4}(-\\d{2})?$" },
          "days_since_reported": { "type": ["integer", "null"], "minimum": 0 },
          "title": { "pattern": "[Cc]hild|[Mm]inor" },
          "summary": {
            "pattern": "Identifying details are withheld by law \\(POCSO s\\.23\\)\\.$"
          },
          "court": { "properties": { "next_hearing": { "const": null } } },
          "status_history": {
            "items": { "properties": { "date": { "pattern": "^\\d{4}-\\d{2}(-\\d{2})?$" } } }
          }
        }
      },
      "else": {
        "properties": {
          "incident_reported_date": { "pattern": "^\\d{4}-\\d{2}-\\d{2}$" },
          "status_history": {
            "items": { "properties": { "date": { "pattern": "^\\d{4}-\\d{2}-\\d{2}$" } } }
          }
        }
      }
    }
  ],
  "examples": [
    {
      "id": "SKS-2026-TG-000123",
      "title": "Aggravated penetrative assault on a child — TESTVILLE (2026)",
      "cnr": "TSHC01-004321-2026",
      "fir_ref": { "station": "TESTVILLE PS", "number": "000/2026" },
      "state": "TG",
      "district": "TESTVILLE",
      "incident_reported_date": "2026-06",
      "offence_sections": ["BNS 64", "POCSO 6"],
      "category": "sexual_assault",
      "minor_involved": true,
      "status": "UNDER_TRIAL",
      "status_history": [
        { "status": "FIR_FILED", "date": "2026-06", "source": 0 }
      ],
      "court": {
        "name": "Special POCSO Court, TESTVILLE",
        "next_hearing": null
      },
      "days_since_reported": null,
      "summary": "A case of aggravated penetrative assault on a child in TESTVILLE, TG (2026). The case is under trial. Identifying details are withheld by law (POCSO s.23).",
      "sources": [
        {
          "url": "https://example.invalid/illustrative",
          "publisher": "eCourts",
          "source_type": "court",
          "retrieved": "2026-07-09"
        }
      ],
      "confidence": 0.94,
      "first_published": "2026-07-09"
    }
  ]
}
