[
  {
    "accused_count": 1,
    "category": "rape",
    "confidence": 1.0,
    "days_since_reported": 51,
    "district": "Unknown",
    "first_published": "2026-09-05",
    "id": "SKS-2026-OD-000002",
    "incident_reported_date": "2026-09-05",
    "institutional_actions": [],
    "minor_involved": false,
    "sources": [
      {
        "publisher": "Hindustan Times",
        "retrieved": "2026-09-05",
        "source_type": "news_article",
        "url": "https://www.hindustantimes.com/india-news/railway-employee-lures-odisha-passenger-with-confirmed-ticket-promise-rapes-her-101788498261322.html"
      }
    ],
    "state": "OD",
    "status": "UNKNOWN",
    "summary": "A railway valve operator allegedly lured a passenger with a confirmed ticket promise and raped her. The railway administration dismissed the employee from service and withheld his pension benefits.",
    "title": "Railway employee dismissed after passenger rape allegation",
    "verification_note": "The source describes a genuine case of rape involving a railway employee and a passenger.",
    "verified": true
  },
  {
    "accused_count": 2,
    "category": "pocso",
    "confidence": 0.95,
    "days_since_reported": 55,
    "district": "Unknown",
    "first_published": "2026-09-09",
    "id": "SKS-2026-OD-000003",
    "incident_reported_date": "2026-09",
    "institutional_actions": [
      "arrest_made"
    ],
    "minor_involved": true,
    "sources": [
      {
        "publisher": "Hindustan Times",
        "retrieved": "2026-09-09",
        "source_type": "news_article",
        "url": "https://www.hindustantimes.com/india-news/16-year-old-tribal-girl-from-jharkhand-raped-at-odisha-shelter-home-watchman-and-juvenile-held-crime-gangrape-101788883534189.html",
        "url_carries_identifying_slug": true
      }
    ],
    "state": "OD",
    "status": "FIR_FILED",
    "summary": "In September 2026, two people were arrested in Odisha for the child sexual offence. An FIR has been filed. Identifying details are withheld by law (POCSO s.23).",
    "title": "Child sexual offence — Odisha (2026) — FIR filed",
    "verified": true
  },
  {
    "accused_count": 6,
    "category": "rape",
    "confidence": 0.95,
    "days_since_reported": 75,
    "district": "Cuttack",
    "first_published": "2026-08-12",
    "id": "SKS-2026-OD-000001",
    "incident_reported_date": "2026-08-12",
    "institutional_actions": [],
    "minor_involved": false,
    "offence_sections": [],
    "sources": [
      {
        "publisher": "The Times of India",
        "retrieved": "2026-08-12",
        "source_type": "news_article",
        "url": "https://timesofindia.indiatimes.com/city/bhubaneswar/woman-out-for-a-drive-with-friend-gangraped-by-6-in-cuttack/articleshow/133187896.cms",
        "url_carries_identifying_slug": true
      }
    ],
    "state": "OD",
    "status": "FIR_FILED",
    "summary": "Six men allegedly assaulted a woman and her friend before gangraping her in Cuttack district. Police have registered a case and are searching for the accused.",
    "title": "Police register case after woman gangraped by six men in Cuttack",
    "verification_note": "The source confirms a gangrape case was reported and registered by the police in Cuttack, Odisha.",
    "verified": true,
    "weapon_or_threat": true
  }
]