[
  {
    "accused_count": 1,
    "category": "pocso",
    "confidence": 0.95,
    "court": {
      "name": "Jharkhand High Court",
      "next_hearing": null
    },
    "days_since_reported": 405,
    "district": "Jamtara",
    "fir_ref": {
      "number": "41/2025",
      "station": "Fatehpur"
    },
    "first_published": "2026-08-20",
    "id": "SKS-2025-JH-000001",
    "incident_reported_date": "2025-09",
    "institutional_actions": [
      "arrest_made",
      "chargesheet_filed",
      "bail_granted"
    ],
    "minor_involved": true,
    "offence_sections": [
      "BNS 96",
      "BNS 64(2)(M)",
      "BNS 81",
      "BNS 137(2)",
      "POCSO 4",
      "POCSO 6"
    ],
    "sources": [
      {
        "publisher": "Jharkhand High Court",
        "retrieved": "2026-08-20",
        "source_type": "court",
        "url": "https://indiankanoon.org/doc/195593805/",
        "url_carries_identifying_slug": true
      }
    ],
    "state": "JH",
    "status": "UNDER_TRIAL",
    "summary": "In September 2025, one person was arrested in Jamtara, Jharkhand for the aggravated penetrative assault on a child. The charges also include kidnapping, procuring a minor and deceit about marriage. Police have filed a chargesheet. Bail was granted. The case is under trial. Identifying details are withheld by law (POCSO s.23).",
    "title": "Aggravated penetrative assault on a child — Jamtara (2025) — on trial",
    "verified": true
  }
]