[
  {
    "accused_count": 2,
    "category": "harassment",
    "cnr": "DLHC010503192026",
    "confidence": 0.95,
    "court": {
      "name": "High Court of Delhi",
      "next_hearing": null
    },
    "days_since_reported": 3204,
    "district": "Dwarka",
    "fir_ref": {
      "number": "11/2018",
      "station": "Dwarka North"
    },
    "first_published": "2026-10-26",
    "id": "SKS-2018-DL-000003",
    "incident_reported_date": "2018-01-17",
    "institutional_actions": [],
    "minor_involved": false,
    "offence_sections": [
      "IPC 354B",
      "IPC 323",
      "IPC 328",
      "IPC 34"
    ],
    "sources": [
      {
        "publisher": "Delhi High Court",
        "retrieved": "2026-10-26",
        "source_type": "court",
        "url": "https://delhihighcourt.nic.in/app/showFileJudgment/59215102026CRLMM78592026_205600.pdf"
      }
    ],
    "state": "DL",
    "status": "QUASHED",
    "summary": "Two people were accused of physical assault and harassment in a 2018 police complaint. The case was registered in Dwarka. Charges were framed against both accused in late 2018. The parties later resolved their domestic disputes amicably and signed a settlement deed. The High Court of Delhi quashed the FIR and ended all related legal proceedings.",
    "title": "Delhi High Court quashes 2018 assault FIR after private settlement",
    "verification_note": "The Delhi High Court quashed the criminal proceedings under Section 354B IPC based on a settlement between the parties.",
    "verified": true
  },
  {
    "category": "pocso",
    "confidence": 0.95,
    "court": {
      "name": "Delhi High Court",
      "next_hearing": null
    },
    "district": "South Delhi",
    "first_published": "2026-07-19",
    "id": "SKS-2018-DL-000001",
    "incident_reported_date": "2018",
    "minor_involved": true,
    "offence_sections": [
      "POCSO"
    ],
    "sources": [
      {
        "publisher": "Delhi High Court",
        "retrieved": "2026-07-19",
        "source_type": "court",
        "url": "https://indiankanoon.org/doc/141261189/",
        "url_carries_identifying_slug": true
      }
    ],
    "state": "DL",
    "status": "APPEAL_PENDING",
    "summary": "In 2018, a case of child sexual offence was registered in South Delhi, Delhi. An appeal is pending. Identifying details are withheld by law (POCSO s.23).",
    "title": "Child sexual offence — South Delhi (2018) — appeal pending",
    "verified": true
  },
  {
    "accused_count": 1,
    "category": "pocso",
    "confidence": 0.9,
    "district": "Delhi",
    "first_published": "2026-08-29",
    "id": "SKS-2018-DL-000002",
    "incident_reported_date": "2018",
    "institutional_actions": [],
    "minor_involved": true,
    "offence_sections": [
      "POCSO"
    ],
    "repeat_offence": true,
    "sources": [
      {
        "publisher": "The Times of India",
        "retrieved": "2026-08-29",
        "source_type": "news_article",
        "url": "https://timesofindia.indiatimes.com/city/delhi/a-pocso-case-a-man-in-coma-a-murdered-model-delhi-gym-trainer-imrans-trail-of-violence-across-8-years/articleshow/133604273.cms",
        "url_carries_identifying_slug": true
      }
    ],
    "state": "DL",
    "status": "UNKNOWN",
    "summary": "In 2018, one person was accused of the child sexual offence in Delhi. The accused is recorded as a repeat offender. The case status is not yet known. Identifying details are withheld by law (POCSO s.23).",
    "title": "Child sexual offence — Delhi (2018)",
    "verified": true
  }
]