[
  {
    "accused_count": 4,
    "category": "pocso",
    "confidence": 0.95,
    "court": {
      "name": "Punjab and Haryana High Court",
      "next_hearing": null
    },
    "days_since_reported": 1911,
    "district": "Sonipat",
    "fir_ref": {
      "number": "467",
      "station": "Kundli"
    },
    "first_published": "2026-08-27",
    "id": "SKS-2021-HR-000002",
    "incident_reported_date": "2021-08",
    "institutional_actions": [
      "arrest_made",
      "chargesheet_filed",
      "convicted",
      "appeal_filed"
    ],
    "minor_involved": true,
    "offence_sections": [
      "POCSO 6",
      "IPC 302",
      "IPC 328",
      "IPC 376D",
      "IPC 506",
      "IPC 120",
      "IPC 34",
      "IPC 376DA",
      "IPC 376AB"
    ],
    "sources": [
      {
        "publisher": "Punjab-Haryana High Court",
        "retrieved": "2026-08-27",
        "source_type": "court",
        "url": "https://indiankanoon.org/doc/144236026/",
        "url_carries_identifying_slug": true
      }
    ],
    "state": "HR",
    "status": "APPEAL_PENDING",
    "summary": "In August 2021, four people were arrested in Sonipat, Haryana for the gang rape involving a minor. The charges also include murder, drugging, criminal intimidation and criminal conspiracy. A weapon was used or a threat was made. Police have filed a chargesheet. The accused were convicted. An appeal against the verdict has been filed. Identifying details are withheld by law (POCSO s.23).",
    "title": "Gang rape involving a minor — Sonipat (2021) — appeal pending",
    "verified": true,
    "weapon_or_threat": true
  },
  {
    "accused_count": 1,
    "category": "pocso",
    "confidence": 0.95,
    "court": {
      "name": "Punjab and Haryana High Court",
      "next_hearing": null
    },
    "days_since_reported": 2003,
    "district": "Palwal",
    "fir_ref": {
      "number": "144/2021",
      "station": "Mundkati"
    },
    "first_published": "2026-08-12",
    "id": "SKS-2021-HR-000001",
    "incident_reported_date": "2021-05",
    "institutional_actions": [
      "arrest_made",
      "chargesheet_filed",
      "convicted",
      "appeal_filed"
    ],
    "minor_involved": true,
    "offence_sections": [
      "IPC 302",
      "IPC 363",
      "IPC 201",
      "POCSO 6",
      "IPC 366",
      "3(1)(W)(I)"
    ],
    "sources": [
      {
        "publisher": "Punjab-Haryana High Court",
        "retrieved": "2026-08-12",
        "source_type": "court",
        "url": "https://indiankanoon.org/doc/75690978/",
        "url_carries_identifying_slug": true
      }
    ],
    "state": "HR",
    "status": "APPEAL_PENDING",
    "summary": "In May 2021, one person was arrested in Palwal, Haryana for the aggravated penetrative assault on a child. The charges also include murder, kidnapping, abduction and destroying evidence. A weapon was used or a threat was made. Police have filed a chargesheet. The accused was convicted. An appeal against the verdict has been filed. Identifying details are withheld by law (POCSO s.23).",
    "title": "Aggravated penetrative assault on a child — Palwal (2021) — appeal pending",
    "verified": true,
    "weapon_or_threat": true
  }
]