[
  {
    "category": "rape",
    "confidence": 0.9,
    "days_since_reported": 1144,
    "district": "Outer Delhi",
    "first_published": "2026-09-19",
    "id": "SKS-2023-DL-000002",
    "incident_reported_date": "2023-09",
    "institutional_actions": [],
    "minor_involved": true,
    "sources": [
      {
        "publisher": "The Hindu",
        "retrieved": "2026-09-19",
        "source_type": "news_article",
        "url": "https://www.thehindu.com/news/cities/Delhi/whose-responsibility-is-womens-safety-rahul-hits-out-at-shah-over-rape-murder-of-16-year-old-in-delhi/article71482417.ece",
        "url_carries_identifying_slug": true
      }
    ],
    "state": "DL",
    "status": "UNKNOWN",
    "summary": "In September 2023, a case of rape involving a minor was registered in Outer Delhi, Delhi. The case status is not yet known. Identifying details are withheld by law (POCSO s.23).",
    "title": "Rape involving a minor — Outer Delhi (2023)",
    "verified": true
  },
  {
    "accused_count": 4,
    "category": "rape",
    "confidence": 0.95,
    "days_since_reported": 1144,
    "district": "Delhi",
    "first_published": "2026-09-19",
    "id": "SKS-2023-DL-000003",
    "incident_reported_date": "2023-09",
    "institutional_actions": [
      "arrest_made"
    ],
    "minor_involved": true,
    "sources": [
      {
        "publisher": "The Hindu",
        "retrieved": "2026-09-20",
        "source_type": "news_article",
        "url": "https://www.thehindu.com/news/cities/Delhi/delhi-girl-raped-stabbed-to-death-police-three-minors-among-four-held/article71478180.ece",
        "url_carries_identifying_slug": true
      },
      {
        "publisher": "The Hindu",
        "retrieved": "2026-09-20",
        "source_type": "news_article",
        "url": "https://www.thehindu.com/news/cities/Delhi/girl-raped-stabbed-to-death-in-delhi-three-minors-among-four-held/article67318047.ece",
        "url_carries_identifying_slug": true
      }
    ],
    "state": "DL",
    "status": "FIR_FILED",
    "summary": "In September 2023, four people were arrested in Delhi for the rape involving a minor. A weapon was used or a threat was made. An FIR has been filed. Identifying details are withheld by law (POCSO s.23).",
    "title": "Rape involving a minor — Delhi (2023) — FIR filed",
    "verified": true,
    "weapon_or_threat": true
  },
  {
    "accused_count": 1,
    "category": "pocso",
    "cnr": "DLHC010285972026",
    "confidence": 1.0,
    "court": {
      "name": "High Court of Delhi"
    },
    "days_since_reported": 1175,
    "district": "South Delhi",
    "fir_ref": {
      "number": "226/2023",
      "station": "Safdarjung Enclave"
    },
    "first_published": "2026-08-18",
    "id": "SKS-2023-DL-000001",
    "incident_reported_date": "2023-08",
    "institutional_actions": [
      "arrest_made",
      "suspension_ordered",
      "acquitted"
    ],
    "minor_involved": true,
    "offence_sections": [
      "IPC 354",
      "IPC 506",
      "POCSO 10"
    ],
    "sources": [
      {
        "publisher": "Delhi High Court",
        "retrieved": "2026-08-18",
        "source_type": "court",
        "url": "https://delhihighcourt.nic.in/app/showFileJudgment/59214082026CCP11322026_181600.pdf",
        "url_carries_identifying_slug": true
      }
    ],
    "state": "DL",
    "status": "ACQUITTED",
    "summary": "In August 2023, one person was arrested in South Delhi, Delhi for the sexual assault of a child. The charges also include criminal intimidation. An official was suspended over the case. The accused was acquitted. Identifying details are withheld by law (POCSO s.23).",
    "title": "Sexual assault of a child — South Delhi (2023) — acquitted",
    "verified": true
  },
  {
    "category": "pocso",
    "cnr": "DLHC010367892026",
    "confidence": 1.0,
    "court": {
      "name": "High Court of Delhi",
      "next_hearing": null
    },
    "days_since_reported": 1206,
    "district": "North-West",
    "fir_ref": {
      "number": "381/2023",
      "station": "Aman Vihar"
    },
    "first_published": "2026-10-09",
    "id": "SKS-2023-DL-000004",
    "incident_reported_date": "2023-07",
    "institutional_actions": [
      "arrest_made",
      "chargesheet_filed",
      "bail_granted"
    ],
    "minor_involved": true,
    "offence_sections": [
      "IPC 363",
      "IPC 368",
      "IPC 376",
      "IPC 328",
      "IPC 34",
      "POCSO 6",
      "POCSO 21"
    ],
    "repeat_offence": false,
    "sources": [
      {
        "publisher": "Delhi High Court",
        "retrieved": "2026-10-09",
        "source_type": "court",
        "url": "https://delhihighcourt.nic.in/app/showFileJudgment/59206102026BA32532026_175018.pdf",
        "url_carries_identifying_slug": true
      }
    ],
    "state": "DL",
    "status": "UNDER_TRIAL",
    "summary": "In July 2023, police made an arrest in North-West, Delhi over the aggravated penetrative assault on a child. The charges also include kidnapping, hiding a kidnapped person, drugging and failing to report the offence. Police have filed a chargesheet. Bail was granted. The case is under trial. Identifying details are withheld by law (POCSO s.23).",
    "title": "Aggravated penetrative assault on a child — North-West (2023) — on trial",
    "verified": true
  }
]