[
  {
    "accused_count": 1,
    "category": "pocso",
    "confidence": 1.0,
    "court": {
      "name": "Punjab and Haryana High Court",
      "next_hearing": null
    },
    "days_since_reported": 1348,
    "district": "Gurugram",
    "fir_ref": {
      "number": "55/2023",
      "station": "Palam Vihar"
    },
    "first_published": "2026-08-12",
    "id": "SKS-2023-HR-000001",
    "incident_reported_date": "2023-02",
    "institutional_actions": [
      "arrest_made",
      "bail_granted"
    ],
    "minor_involved": true,
    "offence_sections": [
      "IPC 363",
      "IPC 366",
      "POCSO 4"
    ],
    "repeat_offence": false,
    "sources": [
      {
        "publisher": "Punjab-Haryana High Court",
        "retrieved": "2026-08-12",
        "source_type": "court",
        "url": "https://indiankanoon.org/doc/126718426/",
        "url_carries_identifying_slug": true
      }
    ],
    "state": "HR",
    "status": "UNDER_TRIAL",
    "summary": "In February 2023, one person was arrested in Gurugram, Haryana for the penetrative assault on a child. The charges also include kidnapping and abduction. Bail was granted. The case is under trial. Identifying details are withheld by law (POCSO s.23).",
    "title": "Penetrative assault on a child — Gurugram (2023) — on trial",
    "verified": true
  }
]